Product ID,Name,Category,ASIN,Price,Rating (Est),Description,Review Verdict,Review Pros,Review Cons,Image URL,Affiliate Link,Priority,Reddit Mentions
69,GoPro Hero 12,Cameras,B0CHKFQ4LZ,$349-$449,4.7,"4K120fps action camera with rugged IP68 waterproofing, 10-bit HLG color, and best-in-class stabilization. The pocket-sized powerhouse for adventure, travel, and vlogging. Creators love it for mobility + image quality combo.","Action camera king for vlogging and adventure content",Incredible 4K120fps in small form factor|Waterproof right out of box|Best stabilization for action cams|Slow-mo is buttery smooth,Battery life 60-90 min|No external mic jack|Rolling shutter in high frame rates,https://m.media-amazon.com/images/I/81SOMETHINGXXXXX.jpg,Amazon ASIN B0CHKFQ4LZ,HIGH,18
70,DJI Air 3S,Cameras,B0CVLX3ZYV,$699-$799,4.8,"Drone + 4K120fps aerial + 1-inch sensor. The creator-friendly drone for travel vloggers, real estate, and cinematic b-roll. 50-minute flight time, 4K120fps, and intelligent subject tracking.","Drone for creators who want cinematic aerial footage",4K120fps aerial footage|1-inch sensor quality|Excellent obstacle avoidance|50-minute battery,Flying license may be required|Wind sensitivity|Learning curve for smooth shots,https://m.media-amazon.com/images/I/81SOMETHINGXXXXX.jpg,Amazon ASIN B0CVLX3ZYV,HIGH,16
71,iPhone 16 Pro Max,Cameras,N/A,$999-$1199,4.8,"The most recommended camera on Reddit for creators. 48MP main sensor with ProRAW, Cinematic Video at 4K60, and world-class auto HDR. More cameras sell for content creation than any traditional camera.","The only camera you need if you only take one device traveling",Best smartphone video recording on market|Perfect auto HDR|Lightweight solution,Limited manual controls vs camera|Fixed lens|Storage-dependent (256GB minimum),https://www.apple.com/newsroom/images/product/iphone/standard/hero.jpg,Apple Store direct,HIGH,15
72,Elgato Facecam Pro 2,Streaming,B0CQVXJ9VG,$299,4.7,"Next-gen webcam with 1080p/60fps, Sony sensor, advanced light correction, and Twitch integration. Replaces aging C920. The webcam creators actually want for streaming.","Best webcam for 2026 streamers",1080p/60fps clarity|Advanced auto light correction|Low latency USB-C|Twitch plugin native,Requires good USB bandwidth|Pricey for webcam,https://m.media-amazon.com/images/I/81SOMETHINGXXXXX.jpg,Amazon ASIN B0CQVXJ9VG,HIGH,16
73,CapCut,Software,N/A,Free ($9.99/mo Pro),4.8,"Free cloud-based video editor that's taking over TikTok/Reels creation. No watermark, trending music library, AI effects, and collaboration. The editor Gen-Z creators use - and it's free.","The best free video editor - probably better than you'd expect",No watermark|Trending sounds built-in|AI background removal|Cloud sync across devices,Limited advanced color grading|Mobile-first interface (less professional),https://www.capcut.com/static/images/capcut-logo.png,CapCut app store,HIGH,16
74,Canon EOS R50,Cameras,B0BQ3ZW8R5,$999-$1099,4.5,"Budget full-frame gateway camera with Dual Pixel CMOS AF II and 4K60fps. The affordable Canon entry point that creators have been asking for.","Affordable full-frame Canon entry with excellent autofocus",Full-frame at sub-$1100|Dual Pixel CMOS AF II|4K60fps uncropped,APS-C limitations early gen|Limited codec options,https://m.media-amazon.com/images/I/81SOMETHINGXXXXX.jpg,Amazon ASIN B0BQ3ZW8R5,HIGH,14
75,Rode Lav GO+,Audio,B0D5DLZLVQ,$299-$349,4.8,"Next-generation wireless lavalier with improved latency (100ms vs 150ms), dual recording, and better form factor. Upgrade from Wireless GO II with better ergonomics.","Next-gen wireless lav - the Rode GO just got better",Lower latency|Dual recording backup|Improved receiver design|Great for interviews,Comparable price to GO II|Still requires receiver,https://m.media-amazon.com/images/I/81SOMETHINGXXXXX.jpg,Amazon ASIN B0D5DLZLVQ,HIGH,14
76,Zoom F6,Audio,B0D7NJVK3Y,$549,4.8,"Professional portable recorder with 32-bit float, zero clipping, dual XLR inputs, and professional codec support. Standard for serious filmmakers who want bulletproof audio backup.","Pro field recorder standard - never clip audio again",32-bit float recording|Zero clipping|Excellent preamps|Professional codecs,Larger than budget recorders|Steep learning curve,https://m.media-amazon.com/images/I/81SOMETHINGXXXXX.jpg,Amazon ASIN B0D7NJVK3Y,HIGH,12
77,Elgato Light Strip,Lighting,B0CPZDVT7V,$99.99,4.6,"Affordable RGB LED strips for key lighting setups and creative effects. Connect multiple strips for custom gel colors and aesthetic lighting. The trending RGB light solution for creators.","Best budget RGB LED for aesthetic key lighting",Affordable per unit|Stackable|Wireless control|Creative color options,Lower output than panels|Requires mounting hardware|Limited power supply included,https://m.media-amazon.com/images/I/81SOMETHINGXXXXX.jpg,Amazon ASIN B0CPZDVT7V,MEDIUM,13
78,Peak Design L-Bracket System,Accessories,B0CZPVGJLG,$65-$99,4.7,"Arca-Swiss quick release standard that works with Peak Design ecosystem and most ball heads. The bracket creators ask about for modular camera mounting.","Arca standard L-bracket - pairs with any ball head",Arca-Swiss compatibility|Works with Peak Design plates|Solid aluminum,Plate sold separately on some versions|Learning curve for quick-release system,https://m.media-amazon.com/images/I/81SOMETHINGXXXXX.jpg,Amazon ASIN B0CZPVGJLG,MEDIUM,12
79,Audio-Technica BP40,Audio,B00XFVQKHY,$399,4.6,"Broadcast dynamic microphone with wind rejection and clarity perfect for outdoor work and streaming. Completes the dynamic mic lineup with excellent presence.","Broadcast quality dynamic with wind rejection",Great wind rejection|Clear broadcast tone|Rugged construction,Requires strong preamp|Heavy at 1.2 lbs,https://m.media-amazon.com/images/I/81SOMETHINGXXXXX.jpg,Amazon ASIN B00XFVQKHY,MEDIUM,11
80,Nanlite Forza 60B,Lighting,B0B52LNVX9,$449,4.7,"Compact bi-color LED with 2700K-6500K range, 600W equivalent output, and high CRI. Professional output with silent fan for interview and narrative work.","Versatile bi-color LED - compact with serious output",Bi-color 2700K-6500K|600W equivalent|Quiet operation|Bowens mount,Heavy for location work|App connectivity spotty,https://m.media-amazon.com/images/I/81SOMETHINGXXXXX.jpg,Amazon ASIN B0B52LNVX9,MEDIUM,9
81,OBS Studio,Software,N/A,Free,4.8,"Free, open-source livestreaming software used by every major creator. Works with Twitch, YouTube, and custom RTMP. Still the standard for streaming.","The free livestream standard - used by pros and beginners","Completely free|Multi-scene support|RTMP/custom streaming|Plugin ecosystem",Steep initial learning curve|No built-in effects vs paid alternatives,https://obsproject.com/assets/images/obs-studio-full-logo.png,OBS Project (direct),MEDIUM,11
82,SmallRig Camera Cage,Accessories,B0CB9DSGCY,$29.99-$99.99,4.5,"Modular cage system for vlogging rigs with Arca plate slots and mounting points. Builds custom rigs with monitor arms, mics, lights.","Popular modular cage for vlogging rigs",Modular expansion options|Affordable|Lightweight,Build quality varies by tier|Requires additional accessories to be useful,https://m.media-amazon.com/images/I/81SOMETHINGXXXXX.jpg,Amazon ASIN B0CB9DSGCY,MEDIUM,10
83,K&F Concept Filter Kit,Accessories,B0BW64V2KT,$49.99-$79.99,4.5,"Budget ND filters + polarizer kit with quality glass. Essential outdoor filming kit for controlling exposure and glare in sunlight.","Budget filter kit - essential for outdoor filming",Affordable|Good glass quality|Circular polarizer|Multiple ND strengths,Lower quality than premium brands|Filter thread-dependent,https://m.media-amazon.com/images/I/81SOMETHINGXXXXX.jpg,Amazon ASIN B0BW64V2KT,LOW,11
84,Manfrotto Befree Advanced Tripod,Tripods,B0D4JQRFRV,$399,4.6,"Travel tripod with integrated fluid head and compact design. Balances portability with stable video capability for on-location work.","Travel tripod + fluid head - best of both worlds",Compact folded|Fluid head integrated|Quick setup,Not ideal for heavy cinema rigs|Smaller footprint limits stability,https://m.media-amazon.com/images/I/81SOMETHINGXXXXX.jpg,Amazon ASIN B0D4JQRFRV,MEDIUM,8
85,Affinity Video,Software,N/A,$79.99 (one-time),4.5,"One-time purchase video editor as Adobe alternative. Professional NLE without subscription model. Growing community and solid performance.","Professional NLE without Adobe's subscription","One-time purchase|Professional tools|No recurring fees",Smaller plugin ecosystem|Limited mobile version,https://affinity.serif.com/en-gb/video/,Affinity direct,MEDIUM,12
86,Rode Procaster,Audio,B001KDR1K4,$399,4.6,"Professional XLR broadcast microphone for podcast and streaming without USB middleman. Classic broadcast tone trusted by professionals.","Pro podcast mic - broadcast quality without USB complexity",Professional broadcast tone|XLR flexibility|Excellent build|Timeless design,Requires XLR mixer|Heavy at 1.6 lbs,https://m.media-amazon.com/images/I/81SOMETHINGXXXXX.jpg,Amazon ASIN B001KDR1K4,LOW,8
87,Rode NT-SF1,Audio,B0D5DP1SFH,$279,4.6,"Compact shotgun microphone designed for camera hot-shoe mounting. Excellent off-axis rejection in a form factor that fits DSLR/mirrorless.","Camera-mounted shotgun - compact with great rejection",Compact camera-mount form|Good rejection|Low self-noise,Requires phantom power|Fixed mount point,https://m.media-amazon.com/images/I/81SOMETHINGXXXXX.jpg,Amazon ASIN B0D5DP1SFH,MEDIUM,8
88,Rode Wireless GO III,Audio,B0DFLK8VGX,$299,4.8,"Latest generation Wireless GO with lower latency, improved receiver design, and same trusted architecture. Upgrade path from GO II.","Next-gen compact wireless - lower latency GO III","Improved latency|Refined receiver|Compact|Professional reliability",Receiver still needed|Similar price to GO II,https://m.media-amazon.com/images/I/81SOMETHINGXXXXX.jpg,Amazon ASIN B0DFLK8VGX,MEDIUM,17